course_code,course_title,credit_hours,course_desc,pre-requisite,course_objectives,course_outcomes
T216A,Cisco networking (CCNA)-A,8,"Students will begin with Cisco networking (CCNA) (T216). This will give them the knowledge, understanding, and skills needed to configure a LAN/WAN using Cisco equipment (which should also leave you well prepared for the industry-standard CCNA certification examination) They will also gain hands-on practical experience of configuring networks at four compulsory day schools.   Cisco Systems are market leaders in supplying networking equipment for the internet. They also have a well-established educational programme for network professionals.   The Arab Open University offers the Cisco Certified Network Associate “CCNA” (ICND1) Version 5 curriculum, which provides the knowledge, understanding, and skills needed to configure a LAN/WAN using Cisco equipment.  The module is composed of two modules: •	Introduction to Networks  •	Routing and switching essentials",,"Provide the student with the knowledge, understanding, and skills needed to configure a LAN/WAN using Cisco equipment.Provide the student with hands-on experience of configuring networks.","A. Knowledge and understandingAfter studying the module the student will be able to:Describe the role of protocol layers in data networks, and describe the devices and services used to support communications in data networks and the InternetDescribe the importance of addressing and naming schemes at various layers of data networks in IPv4 and IPv6 environmentsDescribe Ethernet and basic switching concepts, as well as the operation of Cisco switchesExplain enhanced switching technologies such as VLANs, VLAN Trunking Protocol (VTP), Rapid Spanning Tree Protocol (RSTP), Per VLAN Spanning Tree Protocol (PVSTP), and 802.1qDescribe the purpose, nature, and operations of a router, routing tables, and the route lookup processDescribe how VLANs create logically separate networks and how routing occurs between themDescribe dynamic routing protocols, distance vector routing protocols, and link-state routing protocolsDescribe the operations and benefits of access control lists (ACLs) Dynamic Host Configuration Protocol (DHCP) and Domain Name System (DNS), and Network Address Translation (NAT)B. Cognitive skillsAfter studying the module the student will be able to:Design, calculate, and apply subnet masks and addresses to fulfil given requirements in IPv4 and IPv6 networkBuild simple Ethernet network using routers and switchesTroubleshoot and monitor networksC. Practical and professional skillsAfter studying the module the student will be able to:Build a simple Ethernet network using routers and switchesUse Cisco command-line interface (CLI) commands to perform basic router and switch configurationsUtilize common network utilities to verify small network operations and analyze data trafficConfigure, monitor and troubleshoot: basic operations of a small switched network, static routing, default routing, basic operations of routers in a small routed network (RIPv1, RIPv2 and OSPF protocols (single-area OSPF)), VLANs, inter-VLAN routing, ACLs for IPv4 and IPv6, and NATD. Key transferable skillsAfter studying the module the student will be able to:Build simple LANs, perform basic configurations for routers and switches, and implement IP addressing schemes.Configure and troubleshoot routers and switches, and resolve common issues with RIPv1, RIPv2, virtual LANs, and inter-VLAN routing in both IPv4 and IPv6 networks."
T216B,Cisco networking (CCNA)-B,8,"Cisco Systems are market leaders in supplying networking equipment for the internet. They also have a well-established educational programme for network professionals.   The Arab Open University offers the Cisco Certified Network Associate “CCNA” (ICND2) Version 5 curriculum, which provides the knowledge, understanding, and skills needed to configure a LAN/WAN using Cisco equipment.  The module is composed of two modules: •	Scaling Networks  •	Connecting networks",,"Provide the student with knowledge, understanding, and skills needed to configure a LAN/WAN using Cisco equipment.Provide the student with hands-on experience of configuring networks.","A. Knowledge and understandingAfter studying the module the student will be able to:Describe the operations and benefits of the Spanning Tree Protocol (STP)Describe the operations and benefits of link aggregation and Cisco VLAN Trunk Protocol (VTP)Describe the operations and benefits of EtherChannel and HSRP.Explain the operations and benefits of Open Shortest Path First (OSPF) protocol (single-area OSPF and multi-area OSPF)Explain the operations and benefits of Enhanced Interior Gateway Routing Protocol (EIGRP)Describe the different WAN technologies and their benefitsExplain the operations and benefits of Standard and Extended Access control list (ACL).xplain the common LAN security threats and how to mitigate themB. Cognitive skillsAfter studying the module the student will be able to:Troubleshoot networksDesign network architectures for borderless networks, data centers and virtualization, and collaboration technology and solutions.C. Practical and professional skillsAfter studying the module the student will be able to:Configure and troubleshoot STP, RSTP, VTP, Extended VLAN, DTP, EtherChannel, HSRP, First Hop Redundancy Protocol, basic operations of routers in a complex routed network for IPv4 and IPv6, advanced operations of routers for IPv4 and IPv6, OSPF, and EIGRP .Configure and troubleshoot serial connections, broadband connections, ACL and IPSec tunnelling operationsMonitor and troubleshoot network operations using syslog, SNMP, and NetFlowD. Key transferable skillsAfter studying the module the student will be able to:Configure and troubleshoot routers and switches. He will also resolve common issues with OSPF, EIGRP, STP, and VTP in both IPv4 and IPv6 networks. In addition, he will also develop the knowledge and skills needed to implement an EtherChannel.Understand the selection criteria of network devices and WAN technologies to meet network requirements. Furthermore, he will learn how to configure and troubleshoot network devices and resolve common issues with data link protocols. Finally, he will also develop the knowledge and skills needed to implement IPSec and virtual private network (VPN) operations in a complex network."
T227,"Change, strategy and projects at work",8,"This module will improve students’ understanding of the origins, nature and consequences of change in the workplace. It also equips them with the knowledge, skills and competencies needed to successfully plan real practical projects. Besides, it allows students to gain an understanding of how ICTs both drive and enable change in the workplace. Moreover, it develops their knowledge, understanding and skills in project working and helps them to apply their new skills and knowledge to the planning of their own project involving the use of ICTs and associated business systems in their workplace.",,"Gain an understanding of how social, technological, economic, environmental, political, legislative and ethical factors drive and enable change in the workplace.Develop knowledge, understanding, confidence and competence in project working and related employability skillsEvaluate, develop and review personal, academic and professional skillsApply skills and knowledge to planning and presenting a project proposal that is capable of being implemented in their workplace.","A. Knowledge and understandingIdentify, analyse and explain the factors driving change in the workplace and the opportunities for introducing change, along with the associated challenges and consequences in terms of human and other factors.Understand and explain the processes involved in designing, planning, monitoring, implementing and reviewing work-based projects.Make effective use of appropriate information and communication technologies, and understand and explain their role in planning and communicating information relating to a work-based project designed to implement some aspect of workplace change.B. Cognitive skillsApply knowledge and understanding effectively to a range of issues, questions and problems arising from the planning of a work-based project.Explore, analyse and evaluate practical ways of improving workplace practices using appropriate information and communication technologies to develop components of a personal work-based project.C. Practical and professional skillsUse the workplace to learn, practise and develop your professional competence.Use appropriate information and communication technologies in a professional context.Plan, organise your time and work effectively.Review, analyse and record ongoing learning needs to maintain and develop skills in the context of the workplace using appropriate information and communication technologies.Develop an awareness of ethical issues relevant to the workplace.D. Key transferable skillsPlan, monitor and evaluate your study as an independent learner.Use appropriate information and communication technologies to support your own learning.Identify, critically assess and use information or data accurately in a range of contexts.Communicate information, arguments and ideas effectively using technologies, styles and language appropriate to purpose and audience.Critically compare, analyse and use a variety of approaches appropriate to understanding issues or problems arising in the context of workplace change and projects."
T316,Advanced Networking,8,"With the continuous advancements in the networking field, the need arises for teaching advanced networking concepts. This advanced undergraduate course aims to meet this objective by discussing advanced networking topics complementing those introduced in T216A/B.",,"Describe the various wireless networks along with their coexistence, cooperation, and interaction, while introducing a system level approach and providing an overview of recent research topics.Describe the concepts of sensor networks along with their underlying challenges, including power efficiency, routing, and multihop communicationsDiscuss the challenges related to massive machine type communications inherent in large sensor networks deployments under the internet of things (IoT) paradigm).Explain the concepts of software defined networks (SDN) and network function virtualization (NFV).Define big data and describe its use in cloud computing.Discuss cloud computing issues, and analyse the role of mobile clouds.Define and discuss quality of experience (QoE) requirements, and compare and contrast QoE with quality of service (QoS).Teach students the concepts of large data centres, data mining, their relation to big data, and explain data management and backup techniques.Explain advanced network management and administration topics, such as: self-organizing networks, network planning and design, and advanced routing.Equip students with advanced skills in personal updating and researching in the field of advanced networking. Students will be taught how to use third-party material in order to extract useful information for their personal and professional development","A. Knowledge and understandingAfter studying the course you will be able to:Describe and analyse the operation of co-existing wireless networks and the possibilities of cooperation and interaction between these networksDiscuss the role of sensor networks and machine-to-machine communications (M2M) in the internet of things (IoT) and describe the underlying challengesDescribe the concepts of software defined networks (SDN) and network function virtualization (NFV), and discuss their role in advanced network management and administrationDiscuss advanced routing concepts, such as the Border Gateway Protocol (BGP)Discuss Cloud Computing and Big Data conceptsDifferentiate between QoE and QoS, and discuss QoE metrics for specific applications, e.g. voice (VoIP) and videoDescribe the operation of self-organizing networks (SON), and differentiate between self-configuration, self-optimization, and self-healingB. Cognitive skillsAfter studying the course you will be able to:Analyse the interaction between different technologies and networks in a complex setup involving multiple networksAnalyse the challenges faced by the different networks and assess the required techniques for enhancing the performance metrics (QoS, QoE, energy efficiency, security, etc.) of the various network types studied in the courseRead, evaluate, and critically review advanced technical documents and extract useful information from these documents on a specific networking topicC. Practical and professional skillsAfter studying the course you will be able to:Use the studied concepts to analyse and assess the operation of complex networksDesign and plan basic implementations of the advanced networks studied, and assess the management and operation of these networks, including the use of self-organization techniquesDesign QoE measurement and resource allocation techniques for enhancing QoE performance of networks using the studied conceptsBe ready to tackle complex networking scenarios through self-learning and research skills coupled with the learned course materialD. Key transferable skillsAfter studying the course you will be able to:Become an independent self-learner in order to remain up-to-date with the continuous advancements in the field of advanced networkingImprove your technical writing skills on topics related to networking and advanced networking"
T318,Applied Network Security,8,"People, organizations, and enterprises are becoming increasingly dependent on digital services. Therefore, the need arises to protect information from being maliciously intercepted, disrupted, or misused.",,"Define the threats to network security, and describe the differences between them.Describe encryption techniques, including symmetric and asymmetric encryption methods.Explain the most widely used encryption algorithms and standards, with focus on wireless, cloud, and internet security.Equip students to be able to assess and manage network security risks, and implement appropriate countermeasures.Allow students to perform independent research in the area and to critically read and analyse third party material.","A. Knowledge and understandingAfter studying the course you will be able to:Describe the operation of encryption techniques: symmetric and asymmetric ciphers, block and stream ciphersDefine and explain the differences between different encryption algorithms and standardsAnalyse and compare the performance of different encryption methodsDesign and implement encryption algorithmsDescribe the protocols for physical, network, and transport level securityDefine the most common threats to network and internet security, explain their operation, and discuss their differencesDescribe the protocols and countermeasures used for protecting network and internet trafficB. Cognitive skillsAfter studying the course you will be able to:Recognise the threats to network security and assess their inherent risksRead, evaluate, and critically review technical documents and extract useful information from these documents on topics related to network security and cryptography algorithmsC. Practical and professional skillsAfter studying the course you will be able to:Use the studied concepts to implement, analyse, and assess different encryption algorithms and techniquesIdentify the threats to network security and take appropriate countermeasuresD. Key transferable skillsAfter studying the course you will be able to:Become an independent self-learner in order to tackle more advanced topics and remain up-to-date in the field of network securityImprove your technical writing skills on topics related to cryptography and network security"
T390,Computer Networks and Network Security,3,"In today’s world, organizations must be prepared to defend against threats in cyberspace. Decision makers must be familiar with the basic principles and best practices of cyber security to best protect their enterprises.",,,
TM103,Computer Organization and Architecture,4,This module offers a clear and comprehensive survey about computer organization and architecture. It introduces the inner workings of a modern digital computer through an integrated presentation of fundamental concepts and principles,,To emphasize on the concept of computer organization.To emphasize on the concept computer architecture.To comprehend the different core concepts behind the hardware layer of a computer system.To recognize the mathematical concepts of the low level computer structure (circuits and gates).To know the processor's instruction sets architecture and implementation.To recognize the memory organization concept and methods,"A. Knowledge and understandingThe module provides student with an understanding of:Historical developments of computers.The Von-Neumann Model.Data representation and arithmetic in Computer Systems.Boolean Algebra and Digital Logic.Assembly language of an intuitive architecture (MARIE).Memory organization and addressing modes.Cache memory mapping Schemes.B. Cognitive skillsTo be able toIdentify the different parts of any computer system and understand their roles.Understand the instruction set of any modern computer system.Evaluate the performance of modern computer systems.C. Practical and professional skillsTo be able toHave an awareness of the process of designing, writing and testing MARIE assembly programs.Use low level programming skills appropriate to a task.Ability to use the MARIE and data path simulator software.D. Key transferable skillsTo be able toInteract effectively within a group using electronic conferencing techniques.Contribute to discussions on a conference.Improve own learning and performance.Communicate effectively about testing strategies, design and low level codes.Use electronic media (the web and electronic conferencing) for information retrieval and communication."
TM105,Introduction to Programming,4,"This module is an introductory level programming module and it is meant to provide basic foundation in computer programming to students. Students will learn how to develop solutions (algorithms) using pseudocode to solve simple problems. Thereafter, they will learn how to implement these solutions using a programming language (Java). This module serves as foundation for second level programming modules.",,"The module aims to:Introduce the technique of solving simple problems using pseudocode.Introduce Java programming via writing, compiling and executing simple programs.Present how to store and deal with data including variables, constants, and expressions.Cover deeply the concepts of program control structure and illustrate each concept with a diagrammatic notation using UML.Present how these concepts are implemented in Java.Introduce the concept of modularization and how to write Java methods.Present how to deal with basic data structures like strings, arrays and two dimensional arrays.","A. Knowledge and understandingAfter studying the module,the student will be able to:Understanding of the design and programming processesKnowledge of the main constructs and mechanisms in programming using Java language.Understanding of the techniques used in developing a medium Java application.Understanding of the basic data structures like strings, arrays and two dimensional arrays.B. Cognitive skillsAfter studying the module,the student should be able to:Describe and apply key concepts and techniques in software design and development.Analyse and abstract away from the details of a problem.Design and formulate an appropriate solution to a problem and evaluate it.Deal professionally with the basic data structures.C. Practical and professional skillsAfter studying the module,the student should be able to:Create, develop and trace Java programs.Use software tools such as a Java IDE and an On-line Java compiler.Use appropriate programming skills.Traverse data in the basic data structures in a professional way.D. Key transferable skillsAfter studying the module,the student should be able to:Find information from a range of sources to support a task.Plan medium tasks.Use Java libraries.Use appropriate numerical, mathematical and abstraction skills."
TM111,Introduction to Computing and Information Technology 1,8,"This is an introductory level 1 module, which provides students with a broad introduction to Computing and Information Technology concepts, principles and theories.",,Help students to develop their understanding about the significant role of computers in our lives.Explore some processes by which sound and images in the real world are captured and stored and may be shared with peers and the wider world through social networking sites.Introduce students to algorithmic thinking and problem-solving skills using examples from everyday life.Enhance student's knowledge about implementing solutions to simple problems in a visual programming.Introduce students to the key concepts and technologies underpinning the communication networks.Prepare the student for further academic study by helping him develop his study skills.,"A. Knowledge and understandingUnderstand the fundamental principles, concepts and techniques underlying Computing and IT.Explore various situations in which Computing and IT systems are used, the ways in which people interact with them, and the possibilities and limitations of such systemsBe aware of the ethical, social and legal issues that can be associated with the development and deployment of Computing & IT systems.Demonstrate an understanding of algorithmic thinking and problem-solving skills using examples from everyday life.Understand the general principles, roles of various components, and the challenges involved in sending data across communication networks.Know how to find, rank and reference information; how to build your information literacy skills and how to interpret data in different forms.B. Cognitive skillsEvaluate key computing and IT concepts in a range of contexts.Apply appropriate techniques and tools for abstracting, modelling, problem solving, designing and testing computing and IT systems.Compare, contrast, critically analyze and refine specifications and implementations of software systems and/or simple hardware systems.Identify situations in which different network technologies may be used.C. Practical and professional skillsCommunicate information, arguments, ideas and issues clearly and in appropriate ways, bearing in mind the audience for and the purpose of your communication.Use appropriate numerical and mathematical skills to carry out calculations and analyze data.Work independently, planning, monitoring, reflecting on and improving your own learningDemonstrate study skills at a level appropriate to higher education, such as study planning, learning from feedback and reading activelyD Key transferable skillsEvaluate computing and IT systems, using appropriate simulation and modelling tools where appropriateUse a range of resources to help you develop as an independent learner.Use information literacy skills, computers and software packages appropriate to the workplace.Communicate appropriately with your tutor and other students using email, online conferences and forums."
